chromosome_37,start_37,chrom,pos,ref,alt,description,civic_actionability_score,civic_id
22,23522397,chr22,23180210,,,"The BCR-ABL fusion protein, commonly referred to as the Philadelphia chromosome, is one of the most studied fusion genes in cancer. It has widely been considered the initiating event in chronic myelogenous leukemia (CML). However, despite its ability to initiate disease in mice, its status as an initiating mutation is in dispute. In what is commonly used as the poster-child for targeted therapeutics, the development and use of imatinib in the clinic has led to profound improvements in the prognosis of the disease. However, imatinib resistance is still seen in patients with mutations in the ABL kinase domain of the fusion, most notably the T315I variant. In patients resistant to imatinib, either acquired or otherwise, second generation BCR-ABL TKI's (dasatinib and nilotinib) have seen some success in delivering a tumor response. Third generation ABL1 inhibitor ponatinib is the only FDA approved drug with activity against T315I . However due to risk of life-threatening blood clots and severe narrowing of blood vessels ponatinib is ONLY approved for T315I-positive CML or T315I-positive Ph+ ALL or in cases of CML, Ph+ ALL with resistance or intolerance to other approved ABL1 inhibitors.",255.5,1
9,133748283,chr9,130872896,C,T,"While the efficacy of imatinib has revolutionized chronic myelogenous leukemia (CML) treatment, it is still not a cure-all. Both initial resistance and acquired resistance as a result of selection have been seen in a small subset of CML patients. The ABL kinase domain mutation T315I (aka T334I) has been shown to be one such mutation that confers resistance to imatinib. Second generation TKI's (dasatinib and ponatinib) specific to BCR-ABL have shown efficacy in treating resistant cases.",146.0,2
9,133738363,chr9,130862976,G,A,"While the efficacy of imatinib has revolutionized chronic myelogenous leukemia (CML) treatment, it is still not a cure-all. Both initial resistance and acquired resistance as a result of selection have been seen in a small subset of CML patients. The ABL kinase domain mutation E255K has been shown to be one such mutation that confers resistance to imatinib. Second generation TKI's (dasatinib and nilotinib) specific to BCR-ABL have shown efficacy in treating resistant cases.",83.0,3
14,105246551,chr14,104780214,C,T,"AKT1 E17K is a recurrent mutation that has been observed in breast, colorectal, lung, and ovarian cancer. It has been convincingly shown to be an activating mutation resulting in PI3K/AKT/mTOR pathway activity. It has been suggested that this mutation decreases the cell's sensitivity to AKT1 allosteric kinase inhibitors. This, and other AKT1 mutations, are the subject of much research and development for therapeutics.",33.5,4
2,42396490,chr2,42169350,,,"The EML4-ALK fusion variant 1 consisting of ALK kinase domain (exons 20-29) fused to EML4 exons 1-13 is the most common EML4-ALK variant, and was discovered in non-small cell lung cancer. Multiple EML4 breakpoint shave been described with differential sensitivity to inhibitors with variant 1 showing greater sensitivity than 3a in cell lines. EML4-ALK is crizotinib sensitive; however, several mutations that confer resistance mutations have been described in case studies. In the only clinical trial for crizotinib that included determination of EML4-ALK variant type in a subset of its participants, a very high response rate was observed, although the numbers were insufficient to validate correlation of variant type to outcome. Preclinical studies with this variant have indicated sensitivity to Hsp90 inhibitors.",38.0,5
2,29445258,chr2,29222392,C,T,"In patients with non-small cell lung cancer exhibiting EML4-ALK fusion, C1156Y has been shown to confer resistance to crizotinib. Case reports indicate that secondary mutations can modulate drug sensitivity. EML4-ALK C1156Y/L1196M maintained crizotinib resistance while the lorlatinib resistant combination EML4-ALK C1156Y/L1198F re-sensitized the tumor to crizotinib treatment.",29.0,6
2,29443631,chr2,29220765,G,T,"In patients with non-small cell lung cancer exhibiting EML4-ALK fusion, L1196M has been shown to confer resistance to crizotinib. This was also true in a patient with both EML4-ALK C1156Y & L1196M.",21.0,7
2,29443695,chr2,29220829,G,T,"ALK F1174L has been observed as recurrent in neuroblastoma, non-small cell lung cancer (NSCLC), and other cancer types. Neuroblastoma cells containing this mutation have shown resistance to low doses of criztonib. However, increased dosage can overcome this resistance in cell lines studies. TAE684 has also proven effective in both NSCLC and neuroblastoma F1174L containing cells.",33.5,8
2,29432664,chr2,29209798,C,T,"ALK R1275Q has been observed as a recurrent mutation in  neuroblastoma, non-small cell lung cancer (NSCLC), as well as other cancer types. Neuroblastoma cells with this mutation have shown sensitivity to the ALK-inhibitor TAE684. This and the geldanamycin deriviative 17-DMAG have been shown to be effective in NSCLC cell lines.",23.0,9
X,47426121,chrX,47566722,C,G,"ARAF S214C has been found to be a recurrent oncogenic mutation in non-small cell lung cancer. It has been shown to confer sensitivity to sorafenib and trametenib in cell lines. In a case study of advanced stage lung adenocarcinoma harboring this mutation, sorafenib also acheived near-complete clinical remission. This case has brought more interest to the variant from a research and clinical perspective.",11.0,10
7,140453135,chr7,140753335,CA,AT,"Patients harboring mutations in valine 600 residue of BRAF have been shown to be sensitive to dabrafenib. For more information on the V600 locus, see the V600E entry.",47.0,11
7,140453136,chr7,140753336,A,T,"BRAF V600E has been shown to be recurrent in many cancer types. It is one of the most widely studied variants in cancer. This variant is correlated with poor prognosis in certain cancer types, including colorectal cancer and papillary thyroid cancer. The targeted therapeutic dabrafenib has been shown to be effective in clinical trials with an array of BRAF mutations and cancer types. Dabrafenib has also shown to be effective when combined with the MEK inhibitor trametinib in colorectal cancer and melanoma. However, in patients with TP53, CDKN2A and KRAS mutations, dabrafenib resistance has been reported. Ipilimumab, regorafenib, vemurafenib, and a number of combination therapies have been successful in treating V600E mutations. However, cetuximab and panitumumab have been largely shown to be ineffective without supplementary treatment.",1353.5,12
7,140453135,chr7,140753335,,,"A case study of a single patient harboring both a V600E and a V600M mutation, dabrafenib was shown to acheive clinical response.",2.5,13
7,140434279,chr7,140734479,,,"Amplification of BRAF V600E has been shown to confer resistance to MEK inhibitors. For more information on the V600 locus, see the V600E entry.",1.0,14
7,140453136,chr7,140753336,,,"BRAF mutations of the valine 600 residue have been shown to be recurrent in many cancer types. Of the V600 mutations, V600E is the most widely researched. V600 mutations as a whole have been correlated to poorer prognosis in colorectal and papilarry thyroid cancers. V600 mutations have also been shown to confer sensitivity to the BRAF inhibitor dabrafenib. For a more detailed summary, click the individual mutations.",460.0,17
11,69455855,chr11,69641087,,,CCND1 amplification has been implicated in poorer prognosis in non-small cell lung cancer.,47.0,18
11,69455855,chr11,69641087,,,"CCND1 expression, and its prognositc impact, is still in dispute. Three experiments in non-small cell lung cancer have shown it to have no impact on survival, but three additional studies have shown it results in poorer prognosis. There is also some ambiguity in how the boundaries between expression and overexpression are defined.",30.0,19
11,69455855,chr11,69641087,,,"Cyclin D has been shown in many cancer types to be misregulated. Well established for their oncogenic properties, the cyclins and the cyclin-dependent kinases (CDK's) they activate have been the focus of major research and development efforts over the past decade. The methods by which the cyclins are misregulated are widely variable, and range from genomic amplification to promoter methylation changes. While Cyclin D2 has only been found to be significantly misregulated in glioma, Cyclin D1 in particular seems to be a pan-cancer actor. Cyclin D misregulation has been shown to lead to poorer outcomes in a number of studies, and currently there are no FDA-approved targeted therapies.",116.0,20
12,4382938,chr12,4273772,,,"Cyclin D has been shown in many cancer types to be misregulated. Well established for their oncogenic properties, the cyclins and the cyclin-dependent kinases (CDK's) they activate have been the focus of major research and development efforts over the past decade. The methods by which the cyclins are misregulated are widely variable, and range from genomic amplification to promoter methylation changes. While Cyclin D2 has only been found to be significantly misregulated in glioma, Cyclin D1 in particular seems to be a pan-cancer actor. Cyclin D misregulation has been shown to lead to poorer outcomes in a number of studies, and currently there are no FDA-approved targeted therapies.",16.0,21
12,4381437,chr12,4272271,,,"Cyclin D has been shown in many cancer types to be misregulated. Well established for their oncogenic properties, the cyclins and the cyclin-dependent kinases (CDK's) they activate have been the focus of major research and development efforts over the past decade. The methods by which the cyclins are misregulated are widely variable, and range from genomic amplification to promoter methylation changes. While Cyclin D2 has only been found to be significantly misregulated in glioma, Cyclin D1 in particular seems to be a pan-cancer actor. Cyclin D misregulation has been shown to lead to poorer outcomes in a number of studies, and currently there are no FDA-approved targeted therapies.",3.0,22
6,41902671,chr6,41934933,,,"Cyclin D has been shown in many cancer types to be misregulated. Well established for their oncogenic properties, the cyclins and the cyclin-dependent kinases (CDK's) they activate have been the focus of major research and development efforts over the past decade. The methods by which the cyclins are deregulated are widely variable, and range from genomic amplification to promoter methylation changes. Cyclin D3 loss has been reported in T-cell acute lymphoblastic leukemia (T-ALL), a seemingly unique trend when compared to the amplifcations and overexpressions of the other cyclin D's. Treating cyclin D3 knockout mice with the targeted therapeutic palbociclib significantly increased the median survival of a Notch-driven model of T-ALL.",3.0,23
19,30302805,chr19,29811898,,,"Cyclin E, while currenly not as widely implicated as its counterpart, cyclin D, has been implicated in various carcinomas, including breast, gastric, stomach and colorectal. High levels of cyclin E, either by gene amplification or overexpression, are correlated with later stage disease and have been shown to lead to poorer prognosis in gastic carcinoma. It has also been shown, in lung cancer specifically, that neoplastic cells with higher levels of the cyclin E/CDK2 complex are more radiosensitive than their lowly expressed counterparts.",62.0,24
12,58141510,chr12,57747727,,,"CDK4, along with its partner CDK6, are key players in cell cycle progression. The complex has been implicated in a number of cancer types, and is the focus of therapeutic research and development. One targeted therapy for CDK inhibition is palbociclib, which may slow the growth of advanced stage breast cancers. It has also been shown, in mouse, that CDK inhibition may sensitize mutant PIK3CA tumors to PI3K inhibitors.",8.0,25
9,21974827,chr9,21974828,,,"CDKN2A loss has been shown to be a significant event in a number of cancer types. One mechanism by which this can occur is by hypermethylation of the CDKN2A promoter region. While no targeted therapeutic has been engaged in clinical trials, the prognostic impact has been studied by a number of meta-analyses. The prognostic impact of promoter hypermethylation has been relatively ambiguous. Many studies have shown significant p-values suggesting poorer prognostic outcomes for patients with hypermethylation in colorectal, liver, and younger lung cancer patients. This being said, there is still research to be done before this becomes a widely-accepted prognostic indicator.",15.0,27
19,33792961,chr19,33302055,,,"CEBPA N-terminal frame shift mutations that result in a premature stop codon are associated with cytogenetically normal acute myeloid leukemia (CN-AML). CEBPA mutations are associated with a favorable prognosis; however, NPM1 and FLT3 mutations should also be assessed in CN-AML patients as concurrent mutations may have prognostic implications. N-terminal frame shift mutations within amino acids 1-120 have been shown to disrupt expression of the full-length 42kDa isoform while maintaining expression of a 30kDa isoform (translated from the AUG at full-length protein isoform amino acid M120). This 30kDa isoform exhibits dominant negative activity.",3.0,28
19,33790840,chr19,33299934,,,"CEBPA mutations are associated with cytogenetically normal acute myeloid leukemia (CN-AML) and a favorable prognosis. However, NPM1 and FLT3 mutations should also be assessed in CN-AML patients as concurrent mutations may have prognostic implications.",105.0,29
1,156446804,chr1,156477012,,,"MEF2D-CSF1R is a fusion that has been observed in acute lymphocytic leukemia. In cell lines harboring this event, treatment with imatinib has shown notable sensitivity.",10.5,30
19,14628951,chr19,14518139,,,"This fusion has been found to be very recurrent in the rare form of adolescent liver cancer, fibrolamellar hepatocellular carcinoma. In one study, this fusion was observed in 15/15 FL-HCC cases examined and functional studies found that the fusion retained kinase activity. The presence of this fusion may be used as a diagnostic marker for this rare tumor type.",75.0,31
2,25457241,chr2,25234372,,,"DNMT3A R882 mutations are associated with cytogenetically normal acute myeloid leukemia (CN-AML) with R882H as the most common form. Mutations in DNMT3A have largely been associated with poorer prognosis, however this is not consistent across all studies. This may be a result of patient age or combining R882 and non-R882 mutations during analysis as studies have indicated independent mechanisms of action and differential prognostic implications for these mutation types. One study that independently analyzed R882 and non-R882 mutations showed R882 mutations were associated with poorer prognosis than patients with wildtype and non-R882 mutations, but only in older patients with AML.",510.0,32
7,55259515,chr7,55191822,T,G,"EGFR L858R has long been recognized as a functionally significant mutation in cancer, and is one of the most prevalent single mutations in lung cancer. Best described in non-small cell lung cancer (NSCLC), the mutation seems to confer sensitivity to first and second generation TKI's like gefitinib and neratinib. NSCLC patients with this mutation treated with TKI's show increased overall and progression-free survival, as compared to chemotherapy alone. Third generation TKI's are currently in clinical trials that specifically focus on mutant forms of EGFR, a few of which have shown efficacy in treating patients that failed to respond to earlier generation TKI therapies.",375.0,33
7,55249071,chr7,55181378,C,T,"EGFR T790M was one of the very first mutations recognized to confer resistance to targeted therapies in non-small cell lung cancer. While successful in amplified EGFR, the efficacy of the first and second generation TKI's (erlotinib, gefitinib, neratinib) in treating patients harboring this mutation before treatment is notably lower. This lack of efficacy can likely be to blame for the poorer prognosis for patients with this mutation as compared to patients with wildtype EGFR or other types of EGFR mutations. Approximately half of EGFR mutant tumors with acquired resistance to TKI inhibition have been shown to harbor this mutation, implicating it as a mechanism of acquired therapy resistence. A third generation TKI (osimertinib) has been approved for the treatment of EGFR T790M mutant NSCLC. Patients positive for T790M in a plasma-based test have similar outcomes like those with tumor biopsy testing.",386.25,34
17,37880261,chr17,39724008,G,C,"ERBB2 D769H was one of the first ERBB2 variants to be functionally classified (Bose et al. 2013). This mutation was shown to be an activating mutation in an in vitro assay. In the same paper, this mutation (along with other ERBB2 activating mutations) in MCF10A breast cancer cell lines were shown to be sensitive to the kinase inhibitor neratinib. More recent evidence may show that HER2 activating mutations confer sensitivity to a host of tyrosine kinase inhibitors, which is the topic of current clinical trials and research.",4.0,35
17,37880261,chr17,39724008,G,T,"ERBB2 D769Y was one of the first ERBB2 variants to be functionally classified (Bose et al., 2013). This mutation was shown to be an activating mutation in an in vitro assay. In the same paper, this mutation (along with other ERBB2 activating mutations) in MCF10A breast cancer cell lines have been shown to be sensitive to the kinase inhibitor neratinib. More recent evidence may show that HER2 acitivating mutations confer sensitivity to a host of tyrosine kinase inhibitors, which is the topic of current clinical trials and research.",4.0,36
17,37880219,chr17,39723966,TTGAGGGAAAACACA,,"ERBB2 in-frame deletion of 755-759 was one of the first ERBB2 variants to be functionally classified (Bose et al. 2013). This mutation was shown to be an activating mutation in an in vitro assay. In the same paper, this mutation (along with other ERBB2 activating mutations) in MCF10A breast cancer cell lines have been shown to be sensitive to the kinase inhibitor neratinib. More recent evidence may show that HER2 acitivating mutations confer sensitivity to a host of tyrosine kinase inhibitors, which is the topic of current clinical trials and research.",5.0,37
17,37868205,chr17,39711952,G,C,"ERBB2 G309A was one of the first ERBB2 variants to be functionally classified (Bose et al. 2013). This mutation was shown to be an activating mutation in an in vitro assay. In the same paper, this mutation (along with other ERBB2 activating mutations) in MCF10A breast cancer cell lines have been shown to be sensitive to the kinase inhibitor neratinib. More recent evidence may show that HER2 acitivating mutations confer sensitivity to a host of tyrosine kinase inhibitors, which is the topic of current clinical trials and research.",5.0,38
17,37880220,chr17,39723967,T,C,"ERBB2 L755S was one of the first ERBB2 variants to be functionally classified (Bose et al. 2013). This mutation was not shown to be an activating mutation, unlike many of the other variants queried. This mutation was also shown to confer resistance to the tyrosine kinase inhibitor lapatinib in MCF10A cell lines.",21.5,39
17,37880220,chr17,39723967,T,G,"ERBB2 L755W was one of the first ERBB2 variants to be functionally classified (Bose et al., 2013). This mutation was shown to be an activating mutation in an in vitro assay. In the same paper, this mutation (along with other ERBB2 activating mutations) in MCF10A breast cancer cell lines have been shown to be sensitive to the kinase inhibitor neratinib. More recent evidence may show that HER2 acitivating mutations confer sensitivity to a host of tyrosine kinase inhibitors, which is the topic of current clinical trials and research.",5.0,40
17,37881011,chr17,39724758,,GGCTCCCCA,"ERBB2 P780 insertion was one of the first ERBB2 variants to be functionally classified (Bose et al. 2013). This mutation was shown to be an activating mutation in an in vitro assay. In the same paper, this mutation (along with other ERBB2 activating mutations) in MCF10A breast cancer cell lines have been shown to be sensitive to the kinase inhibitor neratinib. More recent evidence may show that HER2 activating mutations confer sensitivity to a host of tyrosine kinase inhibitors, which is the topic of current clinical trials and research.",12.5,41
17,37879658,chr17,39723405,G,A,"ERBB2 R678Q was shown to have NO functional effect in tissue culture assay (Bose et al 2013). This conclusion was confirmed by a second, independent lab.",5.0,42
17,37881616,chr17,39725363,C,T,"ERBB2 R896C was one of the first ERBB2 variants to be functionally classified (Bose et al. 2013). This mutation was shown to be an activating mutation in an in vitro assay. In the same paper, this mutation (along with other ERBB2 activating mutations) in MCF10A breast cancer cell lines have been shown to be sensitive to the kinase inhibitor neratinib. More recent evidence may show that HER2 acitivating mutations confer sensitivity to a host of tyrosine kinase inhibitors, which is the topic of current clinical trials and research.",5.0,43
17,37881000,chr17,39724747,G,T,"ERBB2 V777L was one of the first ERBB2 variants to be functionally classified (Bose et al. 2013). This mutation was shown to be an activating mutation in an in vitro assay. In the same paper, this mutation (along with other ERBB2 activating mutations) in MCF10A breast cancer cell lines have been shown to be sensitive to the kinase inhibitor neratinib. More recent evidence may show that HER2 acitivating mutations confer sensitivity to a host of tyrosine kinase inhibitors, which is the topic of current clinical trials and research.",9.0,44
17,37881332,chr17,39725079,G,A,"ERBB2 V842I was one of the first ERBB2 variants to be functionally classified (Bose et al. 2013). This mutation was shown to be an activating mutation in an in vitro assay. In the same paper, this mutation (along with other ERBB2 activating mutations) in MCF10A breast cancer cell lines have been shown to be sensitive to the kinase inhibitor neratinib. More recent evidence may show that HER2 acitivating mutations confer sensitivity to a host of tyrosine kinase inhibitors, which is the topic of current clinical trials and research.",9.0,45
6,152419920,chr6,152098785,TC,AG,"ESR1 biology has become a central focus in breast cancer therapy. In ER+ tumors, mutations in the ESR1 ligand binding domain have been shown to confer resistance to hormone therapy. This evidence has led to an increased use of targeted sequencing of the estrogen receptor in breast and ovarian cancer. Y536Q is one of these ligand binding domain mutations, and is commonly implicated in this hormone resistance. Preliminary data suggests ER-degrading agents, such as fulvestrant, may be beneficial in treating ESR1 mutant, hormone resistant breast cancers.",8.0,46
6,152419926,chr6,152098791,A,G,"ESR1 biology has become a central focus in breast cancer therapy. In ER+ tumors, mutations in the ESR1 ligand binding domain have been shown to confer resistance to hormone therapy. This evidence has led to an increased use of targeted sequencing of the estrogen receptor in breast and ovarian cancer. D538G is one of these ligand binding domain mutations, and is commonly implicated in this hormone resistance. Preliminary data suggests ER-degrading agents, such as fulvestrant, may be beneficial in treating ESR1 mutant, hormone resistant breast cancers.",18.0,47
6,152419923,chr6,152098788,A,G,"ESR1 biology has become a central focus in breast cancer therapy. In ER+ tumors, mutations in the ESR1 ligand binding domain have been shown to confer resistance to hormone therapy. This evidence has led to an increased use of targeted sequencing of the estrogen receptor in breast and ovarian cancer. Y537C is one of these ligand binding domain mutations, and is commonly implicated in this hormone resistance. Preliminary data suggests ER-degrading agents, such as fulvestrant, may be beneficial in treating ESR1 mutant, hormone resistant breast cancers.",8.0,48
6,152419922,chr6,152098787,T,A,"ESR1 biology has become a central focus in breast cancer therapy. In ER+ tumors, mutations in the ESR1 ligand binding domain have been shown to confer resistance to hormone therapy. This evidence has led to an increased use of targeted sequencing of the estrogen receptor in breast and ovarian cancer. Y537N is one of these ligand binding domain mutations, and is commonly implicated in this hormone resistance. Preliminary data suggests ER-degrading agents, such as fulvestrant, may be beneficial in treating ESR1 mutant, hormone resistant breast cancers.",8.0,49
6,152419923,chr6,152098788,A,C,"ESR1 biology has become a central focus in breast cancer therapy. In ER+ tumors, mutations in the ESR1 ligand binding domain have been shown to confer resistance to hormone therapy. This evidence has led to an increased use of targeted sequencing of the estrogen receptor in breast and ovarian cancer. Y537S is one of these ligand binding domain mutations, and is commonly implicated in this hormone resistance. Preliminary data suggests ER-degrading agents, such as fulvestrant, may be beneficial in treating ESR1 mutant, hormone resistant breast cancers.",8.0,50
